{
  "address": "0xDaF8d1326ECf17C46661D5852Ea74b420F9368Af",
  "abi": [
    {
      "inputs": [
        {
          "internalType": "contract ArbitrumL1InboxLike",
          "name": "_l1ArbitrumInbox",
          "type": "address"
        },
        {
          "internalType": "contract ArbitrumL1ERC20GatewayLike",
          "name": "_l1ERC20GatewayRouter",
          "type": "address"
        }
      ],
      "stateMutability": "nonpayable",
      "type": "constructor"
    },
    {
      "anonymous": false,
      "inputs": [
        {
          "indexed": false,
          "internalType": "address",
          "name": "target",
          "type": "address"
        },
        {
          "indexed": false,
          "internalType": "bytes",
          "name": "message",
          "type": "bytes"
        }
      ],
      "name": "MessageRelayed",
      "type": "event"
    },
    {
      "anonymous": false,
      "inputs": [
        {
          "indexed": false,
          "internalType": "address",
          "name": "l1Token",
          "type": "address"
        },
        {
          "indexed": false,
          "internalType": "address",
          "name": "l2Token",
          "type": "address"
        },
        {
          "indexed": false,
          "internalType": "uint256",
          "name": "amount",
          "type": "uint256"
        },
        {
          "indexed": false,
          "internalType": "address",
          "name": "to",
          "type": "address"
        }
      ],
      "name": "TokensRelayed",
      "type": "event"
    },
    {
      "inputs": [],
      "name": "RELAY_MESSAGE_L2_GAS_LIMIT",
      "outputs": [
        {
          "internalType": "uint32",
          "name": "",
          "type": "uint32"
        }
      ],
      "stateMutability": "view",
      "type": "function"
    },
    {
      "inputs": [],
      "name": "RELAY_TOKENS_L2_GAS_LIMIT",
      "outputs": [
        {
          "internalType": "uint32",
          "name": "",
          "type": "uint32"
        }
      ],
      "stateMutability": "view",
      "type": "function"
    },
    {
      "inputs": [
        {
          "internalType": "uint32",
          "name": "l2GasLimit",
          "type": "uint32"
        }
      ],
      "name": "getL1CallValue",
      "outputs": [
        {
          "internalType": "uint256",
          "name": "",
          "type": "uint256"
        }
      ],
      "stateMutability": "pure",
      "type": "function"
    },
    {
      "inputs": [],
      "name": "l1ERC20GatewayRouter",
      "outputs": [
        {
          "internalType": "contract ArbitrumL1ERC20GatewayLike",
          "name": "",
          "type": "address"
        }
      ],
      "stateMutability": "view",
      "type": "function"
    },
    {
      "inputs": [],
      "name": "l1Inbox",
      "outputs": [
        {
          "internalType": "contract ArbitrumL1InboxLike",
          "name": "",
          "type": "address"
        }
      ],
      "stateMutability": "view",
      "type": "function"
    },
    {
      "inputs": [],
      "name": "l2GasPrice",
      "outputs": [
        {
          "internalType": "uint256",
          "name": "",
          "type": "uint256"
        }
      ],
      "stateMutability": "view",
      "type": "function"
    },
    {
      "inputs": [],
      "name": "l2MaxSubmissionCost",
      "outputs": [
        {
          "internalType": "uint256",
          "name": "",
          "type": "uint256"
        }
      ],
      "stateMutability": "view",
      "type": "function"
    },
    {
      "inputs": [],
      "name": "l2RefundL2Address",
      "outputs": [
        {
          "internalType": "address",
          "name": "",
          "type": "address"
        }
      ],
      "stateMutability": "view",
      "type": "function"
    },
    {
      "inputs": [
        {
          "internalType": "address",
          "name": "target",
          "type": "address"
        },
        {
          "internalType": "bytes",
          "name": "message",
          "type": "bytes"
        }
      ],
      "name": "relayMessage",
      "outputs": [],
      "stateMutability": "payable",
      "type": "function"
    },
    {
      "inputs": [
        {
          "internalType": "address",
          "name": "l1Token",
          "type": "address"
        },
        {
          "internalType": "address",
          "name": "l2Token",
          "type": "address"
        },
        {
          "internalType": "uint256",
          "name": "amount",
          "type": "uint256"
        },
        {
          "internalType": "address",
          "name": "to",
          "type": "address"
        }
      ],
      "name": "relayTokens",
      "outputs": [],
      "stateMutability": "payable",
      "type": "function"
    }
  ],
  "transactionHash": "0x777bcf64345a346834d0f64501c24b3e56ee2e8c81f7976f39e7c0c2aba25d6d",
  "receipt": {
    "to": null,
    "from": "0x9A8f92a830A5cB89a3816e3D267CB7791c16b04D",
    "contractAddress": "0xDaF8d1326ECf17C46661D5852Ea74b420F9368Af",
    "transactionIndex": 225,
    "gasUsed": "847357",
    "logsBloom": "0x00000000000000000000000000000000000000000000000000000000000000000000000000000000000000000000000000000000000000000000000000000000000000000000000000000000000000000000000000000000000000000000000000000000000000000000000000000000000000000000000000000000000000000000000000000000000000000000000000000000000000000000000000000000000000000000000000000000000000000000000000000000000000000000000000000000000000000000000000000000000000000000000000000000000000000000000000000000000000000000000000000000000000000000000000000000",
    "blockHash": "0x4ab464f305b147af6ef220d1057a109351f1f6af0c95e390c7b67bdf72d203ff",
    "transactionHash": "0x777bcf64345a346834d0f64501c24b3e56ee2e8c81f7976f39e7c0c2aba25d6d",
    "logs": [],
    "blockNumber": 8842165,
    "cumulativeGasUsed": "28727580",
    "status": 1,
    "byzantium": true
  },
  "args": ["0x6BEbC4925716945D46F0Ec336D5C2564F419682C", "0x4c7708168395aEa569453Fc36862D2ffcDaC588c"],
  "numDeployments": 1,
  "solcInputHash": "e3638a53e1e5b7b0c7a6b5bbdc94b1ad",
  "metadata": "{\"compiler\":{\"version\":\"0.8.18+commit.87f61d96\"},\"language\":\"Solidity\",\"output\":{\"abi\":[{\"inputs\":[{\"internalType\":\"contract ArbitrumL1InboxLike\",\"name\":\"_l1ArbitrumInbox\",\"type\":\"address\"},{\"internalType\":\"contract ArbitrumL1ERC20GatewayLike\",\"name\":\"_l1ERC20GatewayRouter\",\"type\":\"address\"}],\"stateMutability\":\"nonpayable\",\"type\":\"constructor\"},{\"anonymous\":false,\"inputs\":[{\"indexed\":false,\"internalType\":\"address\",\"name\":\"target\",\"type\":\"address\"},{\"indexed\":false,\"internalType\":\"bytes\",\"name\":\"message\",\"type\":\"bytes\"}],\"name\":\"MessageRelayed\",\"type\":\"event\"},{\"anonymous\":false,\"inputs\":[{\"indexed\":false,\"internalType\":\"address\",\"name\":\"l1Token\",\"type\":\"address\"},{\"indexed\":false,\"internalType\":\"address\",\"name\":\"l2Token\",\"type\":\"address\"},{\"indexed\":false,\"internalType\":\"uint256\",\"name\":\"amount\",\"type\":\"uint256\"},{\"indexed\":false,\"internalType\":\"address\",\"name\":\"to\",\"type\":\"address\"}],\"name\":\"TokensRelayed\",\"type\":\"event\"},{\"inputs\":[],\"name\":\"RELAY_MESSAGE_L2_GAS_LIMIT\",\"outputs\":[{\"internalType\":\"uint32\",\"name\":\"\",\"type\":\"uint32\"}],\"stateMutability\":\"view\",\"type\":\"function\"},{\"inputs\":[],\"name\":\"RELAY_TOKENS_L2_GAS_LIMIT\",\"outputs\":[{\"internalType\":\"uint32\",\"name\":\"\",\"type\":\"uint32\"}],\"stateMutability\":\"view\",\"type\":\"function\"},{\"inputs\":[{\"internalType\":\"uint32\",\"name\":\"l2GasLimit\",\"type\":\"uint32\"}],\"name\":\"getL1CallValue\",\"outputs\":[{\"internalType\":\"uint256\",\"name\":\"\",\"type\":\"uint256\"}],\"stateMutability\":\"pure\",\"type\":\"function\"},{\"inputs\":[],\"name\":\"l1ERC20GatewayRouter\",\"outputs\":[{\"internalType\":\"contract ArbitrumL1ERC20GatewayLike\",\"name\":\"\",\"type\":\"address\"}],\"stateMutability\":\"view\",\"type\":\"function\"},{\"inputs\":[],\"name\":\"l1Inbox\",\"outputs\":[{\"internalType\":\"contract ArbitrumL1InboxLike\",\"name\":\"\",\"type\":\"address\"}],\"stateMutability\":\"view\",\"type\":\"function\"},{\"inputs\":[],\"name\":\"l2GasPrice\",\"outputs\":[{\"internalType\":\"uint256\",\"name\":\"\",\"type\":\"uint256\"}],\"stateMutability\":\"view\",\"type\":\"function\"},{\"inputs\":[],\"name\":\"l2MaxSubmissionCost\",\"outputs\":[{\"internalType\":\"uint256\",\"name\":\"\",\"type\":\"uint256\"}],\"stateMutability\":\"view\",\"type\":\"function\"},{\"inputs\":[],\"name\":\"l2RefundL2Address\",\"outputs\":[{\"internalType\":\"address\",\"name\":\"\",\"type\":\"address\"}],\"stateMutability\":\"view\",\"type\":\"function\"},{\"inputs\":[{\"internalType\":\"address\",\"name\":\"target\",\"type\":\"address\"},{\"internalType\":\"bytes\",\"name\":\"message\",\"type\":\"bytes\"}],\"name\":\"relayMessage\",\"outputs\":[],\"stateMutability\":\"payable\",\"type\":\"function\"},{\"inputs\":[{\"internalType\":\"address\",\"name\":\"l1Token\",\"type\":\"address\"},{\"internalType\":\"address\",\"name\":\"l2Token\",\"type\":\"address\"},{\"internalType\":\"uint256\",\"name\":\"amount\",\"type\":\"uint256\"},{\"internalType\":\"address\",\"name\":\"to\",\"type\":\"address\"}],\"name\":\"relayTokens\",\"outputs\":[],\"stateMutability\":\"payable\",\"type\":\"function\"}],\"devdoc\":{\"details\":\"Public functions calling external contracts do not guard against reentrancy because they are expected to be called via delegatecall, which will execute this contract's logic within the context of the originating contract. For example, the HubPool will delegatecall these functions, therefore its only necessary that the HubPool's methods that call this contract's logic guard against reentrancy.\",\"kind\":\"dev\",\"methods\":{\"constructor\":{\"params\":{\"_l1ArbitrumInbox\":\"Inbox helper contract to send messages to Arbitrum.\",\"_l1ERC20GatewayRouter\":\"ERC20 gateway router contract to send tokens to Arbitrum.\"}},\"getL1CallValue(uint32)\":{\"returns\":{\"_0\":\"amount of ETH that this contract needs to hold in order for relayMessage to succeed.\"}},\"relayMessage(address,bytes)\":{\"params\":{\"message\":\"Data to send to target.\",\"target\":\"Contract on Arbitrum that will receive message.\"}},\"relayTokens(address,address,uint256,address)\":{\"params\":{\"amount\":\"Amount of L1 tokens to deposit and L2 tokens to receive.\",\"l1Token\":\"L1 token to deposit.\",\"l2Token\":\"L2 token to receive.\",\"to\":\"Bridge recipient.\"}}},\"version\":1},\"userdoc\":{\"kind\":\"user\",\"methods\":{\"constructor\":{\"notice\":\"Constructs new Adapter.\"},\"getL1CallValue(uint32)\":{\"notice\":\"Returns required amount of ETH to send a message via the Inbox.\"},\"relayMessage(address,bytes)\":{\"notice\":\"Send cross-chain message to target on Arbitrum.This contract must hold at least getL1CallValue() amount of ETH to send a message via the Inbox successfully, or the message will get stuck.\"},\"relayTokens(address,address,uint256,address)\":{\"notice\":\"Bridge tokens to Arbitrum.This contract must hold at least getL1CallValue() amount of ETH to send a message via the Inbox successfully, or the message will get stuck.\"}},\"notice\":\"Contract containing logic to send messages from L1 to Arbitrum.\",\"version\":1}},\"settings\":{\"compilationTarget\":{\"contracts/chain-adapters/Arbitrum_Adapter.sol\":\"Arbitrum_Adapter\"},\"evmVersion\":\"paris\",\"libraries\":{},\"metadata\":{\"bytecodeHash\":\"ipfs\",\"useLiteralContent\":true},\"optimizer\":{\"enabled\":true,\"runs\":1000000},\"remappings\":[],\"viaIR\":true},\"sources\":{\"@openzeppelin/contracts/token/ERC20/IERC20.sol\":{\"content\":\"// SPDX-License-Identifier: MIT\\n// OpenZeppelin Contracts (last updated v4.6.0) (token/ERC20/IERC20.sol)\\n\\npragma solidity ^0.8.0;\\n\\n/**\\n * @dev Interface of the ERC20 standard as defined in the EIP.\\n */\\ninterface IERC20 {\\n    /**\\n     * @dev Emitted when `value` tokens are moved from one account (`from`) to\\n     * another (`to`).\\n     *\\n     * Note that `value` may be zero.\\n     */\\n    event Transfer(address indexed from, address indexed to, uint256 value);\\n\\n    /**\\n     * @dev Emitted when the allowance of a `spender` for an `owner` is set by\\n     * a call to {approve}. `value` is the new allowance.\\n     */\\n    event Approval(address indexed owner, address indexed spender, uint256 value);\\n\\n    /**\\n     * @dev Returns the amount of tokens in existence.\\n     */\\n    function totalSupply() external view returns (uint256);\\n\\n    /**\\n     * @dev Returns the amount of tokens owned by `account`.\\n     */\\n    function balanceOf(address account) external view returns (uint256);\\n\\n    /**\\n     * @dev Moves `amount` tokens from the caller's account to `to`.\\n     *\\n     * Returns a boolean value indicating whether the operation succeeded.\\n     *\\n     * Emits a {Transfer} event.\\n     */\\n    function transfer(address to, uint256 amount) external returns (bool);\\n\\n    /**\\n     * @dev Returns the remaining number of tokens that `spender` will be\\n     * allowed to spend on behalf of `owner` through {transferFrom}. This is\\n     * zero by default.\\n     *\\n     * This value changes when {approve} or {transferFrom} are called.\\n     */\\n    function allowance(address owner, address spender) external view returns (uint256);\\n\\n    /**\\n     * @dev Sets `amount` as the allowance of `spender` over the caller's tokens.\\n     *\\n     * Returns a boolean value indicating whether the operation succeeded.\\n     *\\n     * IMPORTANT: Beware that changing an allowance with this method brings the risk\\n     * that someone may use both the old and the new allowance by unfortunate\\n     * transaction ordering. One possible solution to mitigate this race\\n     * condition is to first reduce the spender's allowance to 0 and set the\\n     * desired value afterwards:\\n     * https://github.com/ethereum/EIPs/issues/20#issuecomment-263524729\\n     *\\n     * Emits an {Approval} event.\\n     */\\n    function approve(address spender, uint256 amount) external returns (bool);\\n\\n    /**\\n     * @dev Moves `amount` tokens from `from` to `to` using the\\n     * allowance mechanism. `amount` is then deducted from the caller's\\n     * allowance.\\n     *\\n     * Returns a boolean value indicating whether the operation succeeded.\\n     *\\n     * Emits a {Transfer} event.\\n     */\\n    function transferFrom(\\n        address from,\\n        address to,\\n        uint256 amount\\n    ) external returns (bool);\\n}\\n\",\"keccak256\":\"0x9750c6b834f7b43000631af5cc30001c5f547b3ceb3635488f140f60e897ea6b\",\"license\":\"MIT\"},\"@openzeppelin/contracts/token/ERC20/extensions/draft-IERC20Permit.sol\":{\"content\":\"// SPDX-License-Identifier: MIT\\n// OpenZeppelin Contracts v4.4.1 (token/ERC20/extensions/draft-IERC20Permit.sol)\\n\\npragma solidity ^0.8.0;\\n\\n/**\\n * @dev Interface of the ERC20 Permit extension allowing approvals to be made via signatures, as defined in\\n * https://eips.ethereum.org/EIPS/eip-2612[EIP-2612].\\n *\\n * Adds the {permit} method, which can be used to change an account's ERC20 allowance (see {IERC20-allowance}) by\\n * presenting a message signed by the account. By not relying on {IERC20-approve}, the token holder account doesn't\\n * need to send a transaction, and thus is not required to hold Ether at all.\\n */\\ninterface IERC20Permit {\\n    /**\\n     * @dev Sets `value` as the allowance of `spender` over ``owner``'s tokens,\\n     * given ``owner``'s signed approval.\\n     *\\n     * IMPORTANT: The same issues {IERC20-approve} has related to transaction\\n     * ordering also apply here.\\n     *\\n     * Emits an {Approval} event.\\n     *\\n     * Requirements:\\n     *\\n     * - `spender` cannot be the zero address.\\n     * - `deadline` must be a timestamp in the future.\\n     * - `v`, `r` and `s` must be a valid `secp256k1` signature from `owner`\\n     * over the EIP712-formatted function arguments.\\n     * - the signature must use ``owner``'s current nonce (see {nonces}).\\n     *\\n     * For more information on the signature format, see the\\n     * https://eips.ethereum.org/EIPS/eip-2612#specification[relevant EIP\\n     * section].\\n     */\\n    function permit(\\n        address owner,\\n        address spender,\\n        uint256 value,\\n        uint256 deadline,\\n        uint8 v,\\n        bytes32 r,\\n        bytes32 s\\n    ) external;\\n\\n    /**\\n     * @dev Returns the current nonce for `owner`. This value must be\\n     * included whenever a signature is generated for {permit}.\\n     *\\n     * Every successful call to {permit} increases ``owner``'s nonce by one. This\\n     * prevents a signature from being used multiple times.\\n     */\\n    function nonces(address owner) external view returns (uint256);\\n\\n    /**\\n     * @dev Returns the domain separator used in the encoding of the signature for {permit}, as defined by {EIP712}.\\n     */\\n    // solhint-disable-next-line func-name-mixedcase\\n    function DOMAIN_SEPARATOR() external view returns (bytes32);\\n}\\n\",\"keccak256\":\"0xf41ca991f30855bf80ffd11e9347856a517b977f0a6c2d52e6421a99b7840329\",\"license\":\"MIT\"},\"@openzeppelin/contracts/token/ERC20/utils/SafeERC20.sol\":{\"content\":\"// SPDX-License-Identifier: MIT\\n// OpenZeppelin Contracts (last updated v4.7.0) (token/ERC20/utils/SafeERC20.sol)\\n\\npragma solidity ^0.8.0;\\n\\nimport \\\"../IERC20.sol\\\";\\nimport \\\"../extensions/draft-IERC20Permit.sol\\\";\\nimport \\\"../../../utils/Address.sol\\\";\\n\\n/**\\n * @title SafeERC20\\n * @dev Wrappers around ERC20 operations that throw on failure (when the token\\n * contract returns false). Tokens that return no value (and instead revert or\\n * throw on failure) are also supported, non-reverting calls are assumed to be\\n * successful.\\n * To use this library you can add a `using SafeERC20 for IERC20;` statement to your contract,\\n * which allows you to call the safe operations as `token.safeTransfer(...)`, etc.\\n */\\nlibrary SafeERC20 {\\n    using Address for address;\\n\\n    function safeTransfer(\\n        IERC20 token,\\n        address to,\\n        uint256 value\\n    ) internal {\\n        _callOptionalReturn(token, abi.encodeWithSelector(token.transfer.selector, to, value));\\n    }\\n\\n    function safeTransferFrom(\\n        IERC20 token,\\n        address from,\\n        address to,\\n        uint256 value\\n    ) internal {\\n        _callOptionalReturn(token, abi.encodeWithSelector(token.transferFrom.selector, from, to, value));\\n    }\\n\\n    /**\\n     * @dev Deprecated. This function has issues similar to the ones found in\\n     * {IERC20-approve}, and its usage is discouraged.\\n     *\\n     * Whenever possible, use {safeIncreaseAllowance} and\\n     * {safeDecreaseAllowance} instead.\\n     */\\n    function safeApprove(\\n        IERC20 token,\\n        address spender,\\n        uint256 value\\n    ) internal {\\n        // safeApprove should only be called when setting an initial allowance,\\n        // or when resetting it to zero. To increase and decrease it, use\\n        // 'safeIncreaseAllowance' and 'safeDecreaseAllowance'\\n        require(\\n            (value == 0) || (token.allowance(address(this), spender) == 0),\\n            \\\"SafeERC20: approve from non-zero to non-zero allowance\\\"\\n        );\\n        _callOptionalReturn(token, abi.encodeWithSelector(token.approve.selector, spender, value));\\n    }\\n\\n    function safeIncreaseAllowance(\\n        IERC20 token,\\n        address spender,\\n        uint256 value\\n    ) internal {\\n        uint256 newAllowance = token.allowance(address(this), spender) + value;\\n        _callOptionalReturn(token, abi.encodeWithSelector(token.approve.selector, spender, newAllowance));\\n    }\\n\\n    function safeDecreaseAllowance(\\n        IERC20 token,\\n        address spender,\\n        uint256 value\\n    ) internal {\\n        unchecked {\\n            uint256 oldAllowance = token.allowance(address(this), spender);\\n            require(oldAllowance >= value, \\\"SafeERC20: decreased allowance below zero\\\");\\n            uint256 newAllowance = oldAllowance - value;\\n            _callOptionalReturn(token, abi.encodeWithSelector(token.approve.selector, spender, newAllowance));\\n        }\\n    }\\n\\n    function safePermit(\\n        IERC20Permit token,\\n        address owner,\\n        address spender,\\n        uint256 value,\\n        uint256 deadline,\\n        uint8 v,\\n        bytes32 r,\\n        bytes32 s\\n    ) internal {\\n        uint256 nonceBefore = token.nonces(owner);\\n        token.permit(owner, spender, value, deadline, v, r, s);\\n        uint256 nonceAfter = token.nonces(owner);\\n        require(nonceAfter == nonceBefore + 1, \\\"SafeERC20: permit did not succeed\\\");\\n    }\\n\\n    /**\\n     * @dev Imitates a Solidity high-level call (i.e. a regular function call to a contract), relaxing the requirement\\n     * on the return value: the return value is optional (but if data is returned, it must not be false).\\n     * @param token The token targeted by the call.\\n     * @param data The call data (encoded using abi.encode or one of its variants).\\n     */\\n    function _callOptionalReturn(IERC20 token, bytes memory data) private {\\n        // We need to perform a low level call here, to bypass Solidity's return data size checking mechanism, since\\n        // we're implementing it ourselves. We use {Address.functionCall} to perform this call, which verifies that\\n        // the target address contains contract code and also asserts for success in the low-level call.\\n\\n        bytes memory returndata = address(token).functionCall(data, \\\"SafeERC20: low-level call failed\\\");\\n        if (returndata.length > 0) {\\n            // Return data is optional\\n            require(abi.decode(returndata, (bool)), \\\"SafeERC20: ERC20 operation did not succeed\\\");\\n        }\\n    }\\n}\\n\",\"keccak256\":\"0x032807210d1d7d218963d7355d62e021a84bf1b3339f4f50be2f63b53cccaf29\",\"license\":\"MIT\"},\"@openzeppelin/contracts/utils/Address.sol\":{\"content\":\"// SPDX-License-Identifier: MIT\\n// OpenZeppelin Contracts (last updated v4.7.0) (utils/Address.sol)\\n\\npragma solidity ^0.8.1;\\n\\n/**\\n * @dev Collection of functions related to the address type\\n */\\nlibrary Address {\\n    /**\\n     * @dev Returns true if `account` is a contract.\\n     *\\n     * [IMPORTANT]\\n     * ====\\n     * It is unsafe to assume that an address for which this function returns\\n     * false is an externally-owned account (EOA) and not a contract.\\n     *\\n     * Among others, `isContract` will return false for the following\\n     * types of addresses:\\n     *\\n     *  - an externally-owned account\\n     *  - a contract in construction\\n     *  - an address where a contract will be created\\n     *  - an address where a contract lived, but was destroyed\\n     * ====\\n     *\\n     * [IMPORTANT]\\n     * ====\\n     * You shouldn't rely on `isContract` to protect against flash loan attacks!\\n     *\\n     * Preventing calls from contracts is highly discouraged. It breaks composability, breaks support for smart wallets\\n     * like Gnosis Safe, and does not provide security since it can be circumvented by calling from a contract\\n     * constructor.\\n     * ====\\n     */\\n    function isContract(address account) internal view returns (bool) {\\n        // This method relies on extcodesize/address.code.length, which returns 0\\n        // for contracts in construction, since the code is only stored at the end\\n        // of the constructor execution.\\n\\n        return account.code.length > 0;\\n    }\\n\\n    /**\\n     * @dev Replacement for Solidity's `transfer`: sends `amount` wei to\\n     * `recipient`, forwarding all available gas and reverting on errors.\\n     *\\n     * https://eips.ethereum.org/EIPS/eip-1884[EIP1884] increases the gas cost\\n     * of certain opcodes, possibly making contracts go over the 2300 gas limit\\n     * imposed by `transfer`, making them unable to receive funds via\\n     * `transfer`. {sendValue} removes this limitation.\\n     *\\n     * https://diligence.consensys.net/posts/2019/09/stop-using-soliditys-transfer-now/[Learn more].\\n     *\\n     * IMPORTANT: because control is transferred to `recipient`, care must be\\n     * taken to not create reentrancy vulnerabilities. Consider using\\n     * {ReentrancyGuard} or the\\n     * https://solidity.readthedocs.io/en/v0.5.11/security-considerations.html#use-the-checks-effects-interactions-pattern[checks-effects-interactions pattern].\\n     */\\n    function sendValue(address payable recipient, uint256 amount) internal {\\n        require(address(this).balance >= amount, \\\"Address: insufficient balance\\\");\\n\\n        (bool success, ) = recipient.call{value: amount}(\\\"\\\");\\n        require(success, \\\"Address: unable to send value, recipient may have reverted\\\");\\n    }\\n\\n    /**\\n     * @dev Performs a Solidity function call using a low level `call`. A\\n     * plain `call` is an unsafe replacement for a function call: use this\\n     * function instead.\\n     *\\n     * If `target` reverts with a revert reason, it is bubbled up by this\\n     * function (like regular Solidity function calls).\\n     *\\n     * Returns the raw returned data. To convert to the expected return value,\\n     * use https://solidity.readthedocs.io/en/latest/units-and-global-variables.html?highlight=abi.decode#abi-encoding-and-decoding-functions[`abi.decode`].\\n     *\\n     * Requirements:\\n     *\\n     * - `target` must be a contract.\\n     * - calling `target` with `data` must not revert.\\n     *\\n     * _Available since v3.1._\\n     */\\n    function functionCall(address target, bytes memory data) internal returns (bytes memory) {\\n        return functionCall(target, data, \\\"Address: low-level call failed\\\");\\n    }\\n\\n    /**\\n     * @dev Same as {xref-Address-functionCall-address-bytes-}[`functionCall`], but with\\n     * `errorMessage` as a fallback revert reason when `target` reverts.\\n     *\\n     * _Available since v3.1._\\n     */\\n    function functionCall(\\n        address target,\\n        bytes memory data,\\n        string memory errorMessage\\n    ) internal returns (bytes memory) {\\n        return functionCallWithValue(target, data, 0, errorMessage);\\n    }\\n\\n    /**\\n     * @dev Same as {xref-Address-functionCall-address-bytes-}[`functionCall`],\\n     * but also transferring `value` wei to `target`.\\n     *\\n     * Requirements:\\n     *\\n     * - the calling contract must have an ETH balance of at least `value`.\\n     * - the called Solidity function must be `payable`.\\n     *\\n     * _Available since v3.1._\\n     */\\n    function functionCallWithValue(\\n        address target,\\n        bytes memory data,\\n        uint256 value\\n    ) internal returns (bytes memory) {\\n        return functionCallWithValue(target, data, value, \\\"Address: low-level call with value failed\\\");\\n    }\\n\\n    /**\\n     * @dev Same as {xref-Address-functionCallWithValue-address-bytes-uint256-}[`functionCallWithValue`], but\\n     * with `errorMessage` as a fallback revert reason when `target` reverts.\\n     *\\n     * _Available since v3.1._\\n     */\\n    function functionCallWithValue(\\n        address target,\\n        bytes memory data,\\n        uint256 value,\\n        string memory errorMessage\\n    ) internal returns (bytes memory) {\\n        require(address(this).balance >= value, \\\"Address: insufficient balance for call\\\");\\n        require(isContract(target), \\\"Address: call to non-contract\\\");\\n\\n        (bool success, bytes memory returndata) = target.call{value: value}(data);\\n        return verifyCallResult(success, returndata, errorMessage);\\n    }\\n\\n    /**\\n     * @dev Same as {xref-Address-functionCall-address-bytes-}[`functionCall`],\\n     * but performing a static call.\\n     *\\n     * _Available since v3.3._\\n     */\\n    function functionStaticCall(address target, bytes memory data) internal view returns (bytes memory) {\\n        return functionStaticCall(target, data, \\\"Address: low-level static call failed\\\");\\n    }\\n\\n    /**\\n     * @dev Same as {xref-Address-functionCall-address-bytes-string-}[`functionCall`],\\n     * but performing a static call.\\n     *\\n     * _Available since v3.3._\\n     */\\n    function functionStaticCall(\\n        address target,\\n        bytes memory data,\\n        string memory errorMessage\\n    ) internal view returns (bytes memory) {\\n        require(isContract(target), \\\"Address: static call to non-contract\\\");\\n\\n        (bool success, bytes memory returndata) = target.staticcall(data);\\n        return verifyCallResult(success, returndata, errorMessage);\\n    }\\n\\n    /**\\n     * @dev Same as {xref-Address-functionCall-address-bytes-}[`functionCall`],\\n     * but performing a delegate call.\\n     *\\n     * _Available since v3.4._\\n     */\\n    function functionDelegateCall(address target, bytes memory data) internal returns (bytes memory) {\\n        return functionDelegateCall(target, data, \\\"Address: low-level delegate call failed\\\");\\n    }\\n\\n    /**\\n     * @dev Same as {xref-Address-functionCall-address-bytes-string-}[`functionCall`],\\n     * but performing a delegate call.\\n     *\\n     * _Available since v3.4._\\n     */\\n    function functionDelegateCall(\\n        address target,\\n        bytes memory data,\\n        string memory errorMessage\\n    ) internal returns (bytes memory) {\\n        require(isContract(target), \\\"Address: delegate call to non-contract\\\");\\n\\n        (bool success, bytes memory returndata) = target.delegatecall(data);\\n        return verifyCallResult(success, returndata, errorMessage);\\n    }\\n\\n    /**\\n     * @dev Tool to verifies that a low level call was successful, and revert if it wasn't, either by bubbling the\\n     * revert reason using the provided one.\\n     *\\n     * _Available since v4.3._\\n     */\\n    function verifyCallResult(\\n        bool success,\\n        bytes memory returndata,\\n        string memory errorMessage\\n    ) internal pure returns (bytes memory) {\\n        if (success) {\\n            return returndata;\\n        } else {\\n            // Look for revert reason and bubble it up if present\\n            if (returndata.length > 0) {\\n                // The easiest way to bubble the revert reason is using memory via assembly\\n                /// @solidity memory-safe-assembly\\n                assembly {\\n                    let returndata_size := mload(returndata)\\n                    revert(add(32, returndata), returndata_size)\\n                }\\n            } else {\\n                revert(errorMessage);\\n            }\\n        }\\n    }\\n}\\n\",\"keccak256\":\"0xd6153ce99bcdcce22b124f755e72553295be6abcd63804cfdffceb188b8bef10\",\"license\":\"MIT\"},\"contracts/chain-adapters/Arbitrum_Adapter.sol\":{\"content\":\"// SPDX-License-Identifier: AGPL-3.0-only\\npragma solidity ^0.8.0;\\n\\nimport \\\"./interfaces/AdapterInterface.sol\\\";\\n\\nimport \\\"@openzeppelin/contracts/token/ERC20/IERC20.sol\\\";\\nimport \\\"@openzeppelin/contracts/token/ERC20/utils/SafeERC20.sol\\\";\\n\\n/**\\n * @notice Interface for Arbitrum's L1 Inbox contract used to send messages to Arbitrum.\\n */\\ninterface ArbitrumL1InboxLike {\\n    /**\\n     * @notice Put a message in the L2 inbox that can be reexecuted for some fixed amount of time if it reverts\\n     * @dev Gas limit and maxFeePerGas should not be set to 1 as that is used to trigger the RetryableData error\\n     * @dev Caller must set msg.value equal to at least `maxSubmissionCost + maxGas * gasPriceBid`.\\n     *      all msg.value will deposited to callValueRefundAddress on L2\\n     * @dev More details can be found here: https://developer.arbitrum.io/arbos/l1-to-l2-messaging\\n     * @param to destination L2 contract address\\n     * @param l2CallValue call value for retryable L2 message\\n     * @param maxSubmissionCost Max gas deducted from user's L2 balance to cover base submission fee\\n     * @param excessFeeRefundAddress gasLimit x maxFeePerGas - execution cost gets credited here on L2 balance\\n     * @param callValueRefundAddress l2Callvalue gets credited here on L2 if retryable txn times out or gets cancelled\\n     * @param gasLimit Max gas deducted from user's L2 balance to cover L2 execution. Should not be set to 1 (magic value used to trigger the RetryableData error)\\n     * @param maxFeePerGas price bid for L2 execution. Should not be set to 1 (magic value used to trigger the RetryableData error)\\n     * @param data ABI encoded data of L2 message\\n     * @return unique message number of the retryable transaction\\n     */\\n    function createRetryableTicket(\\n        address to,\\n        uint256 l2CallValue,\\n        uint256 maxSubmissionCost,\\n        address excessFeeRefundAddress,\\n        address callValueRefundAddress,\\n        uint256 gasLimit,\\n        uint256 maxFeePerGas,\\n        bytes calldata data\\n    ) external payable returns (uint256);\\n\\n    /**\\n     * @notice Put a message in the L2 inbox that can be reexecuted for some fixed amount of time if it reverts\\n     * @dev Same as createRetryableTicket, but does not guarantee that submission will succeed by requiring the needed\\n     * funds come from the deposit alone, rather than falling back on the user's L2 balance\\n     * @dev Advanced usage only (does not rewrite aliases for excessFeeRefundAddress and callValueRefundAddress).\\n     * createRetryableTicket method is the recommended standard.\\n     * @dev Gas limit and maxFeePerGas should not be set to 1 as that is used to trigger the RetryableData error\\n     * @param to destination L2 contract address\\n     * @param l2CallValue call value for retryable L2 message\\n     * @param maxSubmissionCost Max gas deducted from user's L2 balance to cover base submission fee\\n     * @param excessFeeRefundAddress gasLimit x maxFeePerGas - execution cost gets credited here on L2 balance\\n     * @param callValueRefundAddress l2Callvalue gets credited here on L2 if retryable txn times out or gets cancelled\\n     * @param gasLimit Max gas deducted from user's L2 balance to cover L2 execution. Should not be set to 1 (magic value used to trigger the RetryableData error)\\n     * @param maxFeePerGas price bid for L2 execution. Should not be set to 1 (magic value used to trigger the RetryableData error)\\n     * @param data ABI encoded data of L2 message\\n     * @return unique message number of the retryable transaction\\n     */\\n    function unsafeCreateRetryableTicket(\\n        address to,\\n        uint256 l2CallValue,\\n        uint256 maxSubmissionCost,\\n        address excessFeeRefundAddress,\\n        address callValueRefundAddress,\\n        uint256 gasLimit,\\n        uint256 maxFeePerGas,\\n        bytes calldata data\\n    ) external payable returns (uint256);\\n}\\n\\n/**\\n * @notice Layer 1 Gateway contract for bridging standard ERC20s to Arbitrum.\\n */\\ninterface ArbitrumL1ERC20GatewayLike {\\n    /**\\n     * @notice Deprecated in favor of outboundTransferCustomRefund but still used in custom bridges\\n     * like the DAI bridge.\\n     * @dev Refunded to aliased L2 address of sender if sender has code on L1, otherwise to to sender's EOA on L2.\\n     * @param _l1Token L1 address of ERC20\\n     * @param _to Account to be credited with the tokens in the L2 (can be the user's L2 account or a contract),\\n     * not subject to L2 aliasing. This account, or its L2 alias if it have code in L1, will also be able to\\n     * cancel the retryable ticket and receive callvalue refund\\n     * @param _amount Token Amount\\n     * @param _maxGas Max gas deducted from user's L2 balance to cover L2 execution\\n     * @param _gasPriceBid Gas price for L2 execution\\n     * @param _data encoded data from router and user\\n     * @return res abi encoded inbox sequence number\\n     */\\n    function outboundTransfer(\\n        address _l1Token,\\n        address _to,\\n        uint256 _amount,\\n        uint256 _maxGas,\\n        uint256 _gasPriceBid,\\n        bytes calldata _data\\n    ) external payable returns (bytes memory);\\n\\n    /**\\n     * @notice Deposit ERC20 token from Ethereum into Arbitrum.\\n     * @dev L2 address alias will not be applied to the following types of addresses on L1:\\n     *      - an externally-owned account\\n     *      - a contract in construction\\n     *      - an address where a contract will be created\\n     *      - an address where a contract lived, but was destroyed\\n     * @param _l1Token L1 address of ERC20\\n     * @param _refundTo Account, or its L2 alias if it have code in L1, to be credited with excess gas refund in L2\\n     * @param _to Account to be credited with the tokens in the L2 (can be the user's L2 account or a contract),\\n     * not subject to L2 aliasing. This account, or its L2 alias if it have code in L1, will also be able to\\n     * cancel the retryable ticket and receive callvalue refund\\n     * @param _amount Token Amount\\n     * @param _maxGas Max gas deducted from user's L2 balance to cover L2 execution\\n     * @param _gasPriceBid Gas price for L2 execution\\n     * @param _data encoded data from router and user\\n     * @return res abi encoded inbox sequence number\\n     */\\n    function outboundTransferCustomRefund(\\n        address _l1Token,\\n        address _refundTo,\\n        address _to,\\n        uint256 _amount,\\n        uint256 _maxGas,\\n        uint256 _gasPriceBid,\\n        bytes calldata _data\\n    ) external payable returns (bytes memory);\\n\\n    /**\\n     * @notice get ERC20 gateway for token.\\n     * @param _token ERC20 address.\\n     * @return address of ERC20 gateway.\\n     */\\n    function getGateway(address _token) external view returns (address);\\n}\\n\\n/**\\n * @notice Contract containing logic to send messages from L1 to Arbitrum.\\n * @dev Public functions calling external contracts do not guard against reentrancy because they are expected to be\\n * called via delegatecall, which will execute this contract's logic within the context of the originating contract.\\n * For example, the HubPool will delegatecall these functions, therefore its only necessary that the HubPool's methods\\n * that call this contract's logic guard against reentrancy.\\n */\\n\\n// solhint-disable-next-line contract-name-camelcase\\ncontract Arbitrum_Adapter is AdapterInterface {\\n    using SafeERC20 for IERC20;\\n\\n    // Amount of ETH allocated to pay for the base submission fee. The base submission fee is a parameter unique to\\n    // retryable transactions; the user is charged the base submission fee to cover the storage costs of keeping their\\n    // ticket\\u2019s calldata in the retry buffer. (current base submission fee is queryable via\\n    // ArbRetryableTx.getSubmissionPrice). ArbRetryableTicket precompile interface exists at L2 address\\n    // 0x000000000000000000000000000000000000006E.\\n    uint256 public constant l2MaxSubmissionCost = 0.01e18;\\n\\n    // L2 Gas price bid for immediate L2 execution attempt (queryable via standard eth*gasPrice RPC)\\n    uint256 public constant l2GasPrice = 5e9; // 5 gWei\\n\\n    uint32 public constant RELAY_TOKENS_L2_GAS_LIMIT = 300_000;\\n    uint32 public constant RELAY_MESSAGE_L2_GAS_LIMIT = 2_000_000;\\n\\n    // This address on L2 receives extra ETH that is left over after relaying a message via the inbox.\\n    address public constant l2RefundL2Address = 0x428AB2BA90Eba0a4Be7aF34C9Ac451ab061AC010;\\n\\n    ArbitrumL1InboxLike public immutable l1Inbox;\\n\\n    ArbitrumL1ERC20GatewayLike public immutable l1ERC20GatewayRouter;\\n\\n    /**\\n     * @notice Constructs new Adapter.\\n     * @param _l1ArbitrumInbox Inbox helper contract to send messages to Arbitrum.\\n     * @param _l1ERC20GatewayRouter ERC20 gateway router contract to send tokens to Arbitrum.\\n     */\\n    constructor(ArbitrumL1InboxLike _l1ArbitrumInbox, ArbitrumL1ERC20GatewayLike _l1ERC20GatewayRouter) {\\n        l1Inbox = _l1ArbitrumInbox;\\n        l1ERC20GatewayRouter = _l1ERC20GatewayRouter;\\n    }\\n\\n    /**\\n     * @notice Send cross-chain message to target on Arbitrum.\\n     * @notice This contract must hold at least getL1CallValue() amount of ETH to send a message via the Inbox\\n     * successfully, or the message will get stuck.\\n     * @param target Contract on Arbitrum that will receive message.\\n     * @param message Data to send to target.\\n     */\\n    function relayMessage(address target, bytes memory message) external payable override {\\n        uint256 requiredL1CallValue = _contractHasSufficientEthBalance(RELAY_MESSAGE_L2_GAS_LIMIT);\\n\\n        l1Inbox.createRetryableTicket{ value: requiredL1CallValue }(\\n            target, // destAddr destination L2 contract address\\n            0, // l2CallValue call value for retryable L2 message\\n            l2MaxSubmissionCost, // maxSubmissionCost Max gas deducted from user's L2 balance to cover base fee\\n            l2RefundL2Address, // excessFeeRefundAddress maxgas * gasprice - execution cost gets credited here on L2\\n            l2RefundL2Address, // callValueRefundAddress l2Callvalue gets credited here on L2 if retryable txn times out or gets cancelled\\n            RELAY_MESSAGE_L2_GAS_LIMIT, // maxGas Max gas deducted from user's L2 balance to cover L2 execution\\n            l2GasPrice, // gasPriceBid price bid for L2 execution\\n            message // data ABI encoded data of L2 message\\n        );\\n\\n        emit MessageRelayed(target, message);\\n    }\\n\\n    /**\\n     * @notice Bridge tokens to Arbitrum.\\n     * @notice This contract must hold at least getL1CallValue() amount of ETH to send a message via the Inbox\\n     * successfully, or the message will get stuck.\\n     * @param l1Token L1 token to deposit.\\n     * @param l2Token L2 token to receive.\\n     * @param amount Amount of L1 tokens to deposit and L2 tokens to receive.\\n     * @param to Bridge recipient.\\n     */\\n    function relayTokens(\\n        address l1Token,\\n        address l2Token, // l2Token is unused for Arbitrum.\\n        uint256 amount,\\n        address to\\n    ) external payable override {\\n        uint256 requiredL1CallValue = _contractHasSufficientEthBalance(RELAY_TOKENS_L2_GAS_LIMIT);\\n\\n        // Approve the gateway, not the router, to spend the hub pool's balance. The gateway, which is different\\n        // per L1 token, will temporarily escrow the tokens to be bridged and pull them from this contract.\\n        address erc20Gateway = l1ERC20GatewayRouter.getGateway(l1Token);\\n        IERC20(l1Token).safeIncreaseAllowance(erc20Gateway, amount);\\n\\n        // `outboundTransfer` expects that the caller includes a bytes message as the last param that includes the\\n        // maxSubmissionCost to use when creating an L2 retryable ticket: https://github.com/OffchainLabs/arbitrum/blob/e98d14873dd77513b569771f47b5e05b72402c5e/packages/arb-bridge-peripherals/contracts/tokenbridge/ethereum/gateway/L1GatewayRouter.sol#L232\\n        bytes memory data = abi.encode(l2MaxSubmissionCost, \\\"\\\");\\n\\n        // Note: Legacy routers don't have the outboundTransferCustomRefund method, so default to using\\n        // outboundTransfer(). Legacy routers are used for the following tokens that are currently enabled:\\n        // - DAI: the implementation of `outboundTransfer` at the current DAI custom gateway\\n        //        (https://etherscan.io/address/0xD3B5b60020504bc3489D6949d545893982BA3011#writeContract) sets the\\n        //        sender as the refund address so the aliased HubPool should receive excess funds. Implementation here:\\n        //        https://github.com/makerdao/arbitrum-dai-bridge/blob/11a80385e2622968069c34d401b3d54a59060e87/contracts/l1/L1DaiGateway.sol#L109\\n        if (l1Token == 0x6B175474E89094C44Da98b954EedeAC495271d0F) {\\n            // This means that the excess ETH to pay for the L2 transaction will be sent to the aliased\\n            // contract address on L2, which we'd have to retrieve via a custom adapter, the Arbitrum_RescueAdapter.\\n            // To do so, in a single transaction: 1) setCrossChainContracts to Arbitrum_RescueAdapter, 2) relayMessage\\n            // with function data = abi.encode(amountToRescue), 3) setCrossChainContracts back to this adapter.\\n            l1ERC20GatewayRouter.outboundTransfer{ value: requiredL1CallValue }(\\n                l1Token,\\n                to,\\n                amount,\\n                RELAY_TOKENS_L2_GAS_LIMIT,\\n                l2GasPrice,\\n                data\\n            );\\n        } else {\\n            l1ERC20GatewayRouter.outboundTransferCustomRefund{ value: requiredL1CallValue }(\\n                l1Token,\\n                l2RefundL2Address,\\n                to,\\n                amount,\\n                RELAY_TOKENS_L2_GAS_LIMIT,\\n                l2GasPrice,\\n                data\\n            );\\n        }\\n        emit TokensRelayed(l1Token, l2Token, amount, to);\\n    }\\n\\n    /**\\n     * @notice Returns required amount of ETH to send a message via the Inbox.\\n     * @return amount of ETH that this contract needs to hold in order for relayMessage to succeed.\\n     */\\n    function getL1CallValue(uint32 l2GasLimit) public pure returns (uint256) {\\n        return l2MaxSubmissionCost + l2GasPrice * l2GasLimit;\\n    }\\n\\n    function _contractHasSufficientEthBalance(uint32 l2GasLimit) internal view returns (uint256 requiredL1CallValue) {\\n        requiredL1CallValue = getL1CallValue(l2GasLimit);\\n        require(address(this).balance >= requiredL1CallValue, \\\"Insufficient ETH balance\\\");\\n    }\\n}\\n\",\"keccak256\":\"0x66b4a19f9c4c90d8cc2905fa0031ac0b5b3306397204ea763cefad6a65adea31\",\"license\":\"AGPL-3.0-only\"},\"contracts/chain-adapters/interfaces/AdapterInterface.sol\":{\"content\":\"// SPDX-License-Identifier: AGPL-3.0-only\\npragma solidity ^0.8.0;\\n\\n/**\\n * @notice Sends cross chain messages and tokens to contracts on a specific L2 network.\\n * This interface is implemented by an adapter contract that is deployed on L1.\\n */\\n\\ninterface AdapterInterface {\\n    event MessageRelayed(address target, bytes message);\\n\\n    event TokensRelayed(address l1Token, address l2Token, uint256 amount, address to);\\n\\n    /**\\n     * @notice Send message to `target` on L2.\\n     * @dev This method is marked payable because relaying the message might require a fee\\n     * to be paid by the sender to forward the message to L2. However, it will not send msg.value\\n     * to the target contract on L2.\\n     * @param target L2 address to send message to.\\n     * @param message Message to send to `target`.\\n     */\\n    function relayMessage(address target, bytes calldata message) external payable;\\n\\n    /**\\n     * @notice Send `amount` of `l1Token` to `to` on L2. `l2Token` is the L2 address equivalent of `l1Token`.\\n     * @dev This method is marked payable because relaying the message might require a fee\\n     * to be paid by the sender to forward the message to L2. However, it will not send msg.value\\n     * to the target contract on L2.\\n     * @param l1Token L1 token to bridge.\\n     * @param l2Token L2 token to receive.\\n     * @param amount Amount of `l1Token` to bridge.\\n     * @param to Bridge recipient.\\n     */\\n    function relayTokens(\\n        address l1Token,\\n        address l2Token,\\n        uint256 amount,\\n        address to\\n    ) external payable;\\n}\\n\",\"keccak256\":\"0xf157352f9f6060f5ab3f6ad788cdff2e9c3b8b77592ab89308e6b591312f2038\",\"license\":\"AGPL-3.0-only\"}},\"version\":1}",
  "bytecode": "0x60c03461009357601f610f1938819003918201601f19168301916001600160401b038311848410176100985780849260409485528339810103126100935780516001600160a01b03918282168203610093576020015191821682036100935760805260a052604051610e6a90816100af82396080518181816101d70152610432015260a0518181816104df0152610bfc0152f35b600080fd5b634e487b7160e01b600052604160045260246000fdfe6080604081815260048036101561001557600080fd5b600092833560e01c9081631ba4a9cb14610bb2575080631fc1ba7614610b1257806328f2716e14610ad657806352c8c75c146104565780638134f385146103e75780639ae36685146103a95780639c3ba2001461035c578063c735281e14610320578063e599477e146102e05763e6eb8ade1461009157600080fd5b817ffffffffffffffffffffffffffffffffffffffffffffffffffffffffffffffffc3601126102dc576100c2610c20565b906024359267ffffffffffffffff84116102675736602385011215610267578382013592856100f085610cd4565b956100fd84519788610c93565b85875236602487830101116102d85785602496602097889301838a01378701015266470de4df82000080471061027c5784908351928380927f679b6ded00000000000000000000000000000000000000000000000000000000825273ffffffffffffffffffffffffffffffffffffffff80931680988301528a6024830152662386f26fc10000604483015273428ab2ba90eba0a4be7af34c9ac451ab061ac0108060648401526084830152621e848060a483015264012a05f20060c483015261010060e4830152816101d361010482018c610d31565b03927f0000000000000000000000000000000000000000000000000000000000000000165af1801561027257610244575b507f9e6c52944e331ba6270e7fe4cea2a4086bae8f7a27e1cdba07f416806f5d0ac493818061023e93519586958652850152830190610d31565b0390a180f35b8390813d831161026b575b6102598183610c93565b810103126102675738610204565b8480fd5b503d61024f565b82513d88823e3d90fd5b606484868551917f08c379a0000000000000000000000000000000000000000000000000000000008352820152601860248201527f496e73756666696369656e74204554482062616c616e636500000000000000006044820152fd5b5080fd5b8280fd5b5050346102d857817ffffffffffffffffffffffffffffffffffffffffffffffffffffffffffffffffc3601126102d85760209051662386f26fc100008152f35b5050346102d857817ffffffffffffffffffffffffffffffffffffffffffffffffffffffffffffffffc3601126102d85760209051621e84808152f35b5050346102d857817ffffffffffffffffffffffffffffffffffffffffffffffffffffffffffffffffc3601126102d8576020905173428ab2ba90eba0a4be7af34c9ac451ab061ac0108152f35b5050346102d857817ffffffffffffffffffffffffffffffffffffffffffffffffffffffffffffffffc3601126102d8576020905164012a05f2008152f35b5050346102d857817ffffffffffffffffffffffffffffffffffffffffffffffffffffffffffffffffc3601126102d8576020905173ffffffffffffffffffffffffffffffffffffffff7f0000000000000000000000000000000000000000000000000000000000000000168152f35b5060807ffffffffffffffffffffffffffffffffffffffffffffffffffffffffffffffffc3601126102dc57610489610c20565b90602491823573ffffffffffffffffffffffffffffffffffffffff93848216809203610ad257604492833593606495863596888816809803610ace576628db3066eac00092834710610a7557908a95949392918a7f000000000000000000000000000000000000000000000000000000000000000016948d8c8951927fbda009fe000000000000000000000000000000000000000000000000000000008452169c8d868401526020998a848b818c5afa918215610a6b578f9286908d938d978792610a26575b505194859384927fdd62ed3e000000000000000000000000000000000000000000000000000000008452308d8501521680988301525afa918215610a1b57916109ea575b508a81018091116109bf57908d918251908a8201927f095ea7b30000000000000000000000000000000000000000000000000000000084528a830152848201528381526105df81610c48565b825192830183811067ffffffffffffffff821117610992578f528983527f5361666545524332303a206c6f772d6c6576656c2063616c6c206661696c65648a8401528d3b1561093857938f9795928f92948f968f9b9996928f938c8f918b8291826106739751925af13d1561092f573d8e61065982610cd4565b916106668b519384610c93565b825281933d92013e610dd6565b8c81518061086f575b505050835193662386f26fc100008d86015280808601528a6060860152606085526106a685610c48565b736b175474e89094c44da98b954eedeac495271d0f880361079c5791610720949391620493e093519c8d9b8c9a8b997fd2ce7d65000000000000000000000000000000000000000000000000000000008b528a015288015286015284015264012a05f200608484015260c060a484015260c4830190610d31565b03925af180156107925791608096959493917fd7e09655439c3932e55857df3220186e5a7f0980825f20691c2b35d941dee75b9893610770575b505b82519586528501528301526060820152a180f35b61078b903d808c833e6107838183610c93565b810190610d74565b503861075a565b87513d8a823e3d90fd5b9a61081594939173428ab2ba90eba0a4be7af34c9ac451ab061ac0109c519c8d9b8c9a8b997f4fb1a07b000000000000000000000000000000000000000000000000000000008b528a0152880152860152840152620493e0608484015264012a05f20060a484015260e060c484015260e4830190610d31565b03925af180156107925791608096959493917fd7e09655439c3932e55857df3220186e5a7f0980825f20691c2b35d941dee75b9893610855575b5061075c565b610868903d808c833e6107838183610c93565b503861084f565b935094509497995094979950838092965001031261092b5787015180159081150361092b576108ab57928c94928c8c938b8d9997388c8161067c565b608492917f5361666545524332303a204552433230206f7065726174696f6e20646964206e7f6f7420737563636565640000000000000000000000000000000000000000000092602a8f8b8b9151977f08c379a0000000000000000000000000000000000000000000000000000000008952880152860152840152820152fd5b8d80fd5b60609150610dd6565b848f7f416464726573733a2063616c6c20746f206e6f6e2d636f6e747261637400000086601d8d8f8c9551957f08c379a0000000000000000000000000000000000000000000000000000000008752860152840152820152fd5b5050878f6041877f4e487b7100000000000000000000000000000000000000000000000000000000835252fd5b878f6011877f4e487b7100000000000000000000000000000000000000000000000000000000835252fd5b90508881813d8311610a14575b610a018183610c93565b81010312610a10575138610593565b8e80fd5b503d6109f7565b8f51903d90823e3d90fd5b9550505050935081813d8311610a64575b610a418183610c93565b810103126102d857519180831683036102d857898f918f9286908c96903861054f565b503d610a37565b81513d85823e3d90fd5b7f496e73756666696369656e74204554482062616c616e63650000000000000000839160188860208f51957f08c379a0000000000000000000000000000000000000000000000000000000008752860152840152820152fd5b8a80fd5b8680fd5b5050346102d857817ffffffffffffffffffffffffffffffffffffffffffffffffffffffffffffffffc3601126102d85760209051620493e08152f35b509190346102d85760207ffffffffffffffffffffffffffffffffffffffffffffffffffffffffffffffffc3601126102d85782359163ffffffff8316809303610baf5764012a05f2009280840293840403610b8357662386f26fc10000928301809311610b83576020838351908152f35b806011857f4e487b71000000000000000000000000000000000000000000000000000000006024945252fd5b80fd5b8490346102d857817ffffffffffffffffffffffffffffffffffffffffffffffffffffffffffffffffc3601126102d85760209073ffffffffffffffffffffffffffffffffffffffff7f0000000000000000000000000000000000000000000000000000000000000000168152f35b6004359073ffffffffffffffffffffffffffffffffffffffff82168203610c4357565b600080fd5b6080810190811067ffffffffffffffff821117610c6457604052565b7f4e487b7100000000000000000000000000000000000000000000000000000000600052604160045260246000fd5b90601f7fffffffffffffffffffffffffffffffffffffffffffffffffffffffffffffffe0910116810190811067ffffffffffffffff821117610c6457604052565b67ffffffffffffffff8111610c6457601f017fffffffffffffffffffffffffffffffffffffffffffffffffffffffffffffffe01660200190565b60005b838110610d215750506000910152565b8181015183820152602001610d11565b907fffffffffffffffffffffffffffffffffffffffffffffffffffffffffffffffe0601f602093610d6d81518092818752878088019101610d0e565b0116010190565b602081830312610c435780519067ffffffffffffffff8211610c43570181601f82011215610c43578051610da781610cd4565b92610db56040519485610c93565b81845260208284010111610c4357610dd39160208085019101610d0e565b90565b90919015610de2575090565b815115610df25750805190602001fd5b610e30906040519182917f08c379a0000000000000000000000000000000000000000000000000000000008352602060048401526024830190610d31565b0390fdfea2646970667358221220582793f3983c41d8e98ba54ca4ffee6e8687e411643bc1ca262563747deed4e864736f6c63430008120033",
  "deployedBytecode": "0x6080604081815260048036101561001557600080fd5b600092833560e01c9081631ba4a9cb14610bb2575080631fc1ba7614610b1257806328f2716e14610ad657806352c8c75c146104565780638134f385146103e75780639ae36685146103a95780639c3ba2001461035c578063c735281e14610320578063e599477e146102e05763e6eb8ade1461009157600080fd5b817ffffffffffffffffffffffffffffffffffffffffffffffffffffffffffffffffc3601126102dc576100c2610c20565b906024359267ffffffffffffffff84116102675736602385011215610267578382013592856100f085610cd4565b956100fd84519788610c93565b85875236602487830101116102d85785602496602097889301838a01378701015266470de4df82000080471061027c5784908351928380927f679b6ded00000000000000000000000000000000000000000000000000000000825273ffffffffffffffffffffffffffffffffffffffff80931680988301528a6024830152662386f26fc10000604483015273428ab2ba90eba0a4be7af34c9ac451ab061ac0108060648401526084830152621e848060a483015264012a05f20060c483015261010060e4830152816101d361010482018c610d31565b03927f0000000000000000000000000000000000000000000000000000000000000000165af1801561027257610244575b507f9e6c52944e331ba6270e7fe4cea2a4086bae8f7a27e1cdba07f416806f5d0ac493818061023e93519586958652850152830190610d31565b0390a180f35b8390813d831161026b575b6102598183610c93565b810103126102675738610204565b8480fd5b503d61024f565b82513d88823e3d90fd5b606484868551917f08c379a0000000000000000000000000000000000000000000000000000000008352820152601860248201527f496e73756666696369656e74204554482062616c616e636500000000000000006044820152fd5b5080fd5b8280fd5b5050346102d857817ffffffffffffffffffffffffffffffffffffffffffffffffffffffffffffffffc3601126102d85760209051662386f26fc100008152f35b5050346102d857817ffffffffffffffffffffffffffffffffffffffffffffffffffffffffffffffffc3601126102d85760209051621e84808152f35b5050346102d857817ffffffffffffffffffffffffffffffffffffffffffffffffffffffffffffffffc3601126102d8576020905173428ab2ba90eba0a4be7af34c9ac451ab061ac0108152f35b5050346102d857817ffffffffffffffffffffffffffffffffffffffffffffffffffffffffffffffffc3601126102d8576020905164012a05f2008152f35b5050346102d857817ffffffffffffffffffffffffffffffffffffffffffffffffffffffffffffffffc3601126102d8576020905173ffffffffffffffffffffffffffffffffffffffff7f0000000000000000000000000000000000000000000000000000000000000000168152f35b5060807ffffffffffffffffffffffffffffffffffffffffffffffffffffffffffffffffc3601126102dc57610489610c20565b90602491823573ffffffffffffffffffffffffffffffffffffffff93848216809203610ad257604492833593606495863596888816809803610ace576628db3066eac00092834710610a7557908a95949392918a7f000000000000000000000000000000000000000000000000000000000000000016948d8c8951927fbda009fe000000000000000000000000000000000000000000000000000000008452169c8d868401526020998a848b818c5afa918215610a6b578f9286908d938d978792610a26575b505194859384927fdd62ed3e000000000000000000000000000000000000000000000000000000008452308d8501521680988301525afa918215610a1b57916109ea575b508a81018091116109bf57908d918251908a8201927f095ea7b30000000000000000000000000000000000000000000000000000000084528a830152848201528381526105df81610c48565b825192830183811067ffffffffffffffff821117610992578f528983527f5361666545524332303a206c6f772d6c6576656c2063616c6c206661696c65648a8401528d3b1561093857938f9795928f92948f968f9b9996928f938c8f918b8291826106739751925af13d1561092f573d8e61065982610cd4565b916106668b519384610c93565b825281933d92013e610dd6565b8c81518061086f575b505050835193662386f26fc100008d86015280808601528a6060860152606085526106a685610c48565b736b175474e89094c44da98b954eedeac495271d0f880361079c5791610720949391620493e093519c8d9b8c9a8b997fd2ce7d65000000000000000000000000000000000000000000000000000000008b528a015288015286015284015264012a05f200608484015260c060a484015260c4830190610d31565b03925af180156107925791608096959493917fd7e09655439c3932e55857df3220186e5a7f0980825f20691c2b35d941dee75b9893610770575b505b82519586528501528301526060820152a180f35b61078b903d808c833e6107838183610c93565b810190610d74565b503861075a565b87513d8a823e3d90fd5b9a61081594939173428ab2ba90eba0a4be7af34c9ac451ab061ac0109c519c8d9b8c9a8b997f4fb1a07b000000000000000000000000000000000000000000000000000000008b528a0152880152860152840152620493e0608484015264012a05f20060a484015260e060c484015260e4830190610d31565b03925af180156107925791608096959493917fd7e09655439c3932e55857df3220186e5a7f0980825f20691c2b35d941dee75b9893610855575b5061075c565b610868903d808c833e6107838183610c93565b503861084f565b935094509497995094979950838092965001031261092b5787015180159081150361092b576108ab57928c94928c8c938b8d9997388c8161067c565b608492917f5361666545524332303a204552433230206f7065726174696f6e20646964206e7f6f7420737563636565640000000000000000000000000000000000000000000092602a8f8b8b9151977f08c379a0000000000000000000000000000000000000000000000000000000008952880152860152840152820152fd5b8d80fd5b60609150610dd6565b848f7f416464726573733a2063616c6c20746f206e6f6e2d636f6e747261637400000086601d8d8f8c9551957f08c379a0000000000000000000000000000000000000000000000000000000008752860152840152820152fd5b5050878f6041877f4e487b7100000000000000000000000000000000000000000000000000000000835252fd5b878f6011877f4e487b7100000000000000000000000000000000000000000000000000000000835252fd5b90508881813d8311610a14575b610a018183610c93565b81010312610a10575138610593565b8e80fd5b503d6109f7565b8f51903d90823e3d90fd5b9550505050935081813d8311610a64575b610a418183610c93565b810103126102d857519180831683036102d857898f918f9286908c96903861054f565b503d610a37565b81513d85823e3d90fd5b7f496e73756666696369656e74204554482062616c616e63650000000000000000839160188860208f51957f08c379a0000000000000000000000000000000000000000000000000000000008752860152840152820152fd5b8a80fd5b8680fd5b5050346102d857817ffffffffffffffffffffffffffffffffffffffffffffffffffffffffffffffffc3601126102d85760209051620493e08152f35b509190346102d85760207ffffffffffffffffffffffffffffffffffffffffffffffffffffffffffffffffc3601126102d85782359163ffffffff8316809303610baf5764012a05f2009280840293840403610b8357662386f26fc10000928301809311610b83576020838351908152f35b806011857f4e487b71000000000000000000000000000000000000000000000000000000006024945252fd5b80fd5b8490346102d857817ffffffffffffffffffffffffffffffffffffffffffffffffffffffffffffffffc3601126102d85760209073ffffffffffffffffffffffffffffffffffffffff7f0000000000000000000000000000000000000000000000000000000000000000168152f35b6004359073ffffffffffffffffffffffffffffffffffffffff82168203610c4357565b600080fd5b6080810190811067ffffffffffffffff821117610c6457604052565b7f4e487b7100000000000000000000000000000000000000000000000000000000600052604160045260246000fd5b90601f7fffffffffffffffffffffffffffffffffffffffffffffffffffffffffffffffe0910116810190811067ffffffffffffffff821117610c6457604052565b67ffffffffffffffff8111610c6457601f017fffffffffffffffffffffffffffffffffffffffffffffffffffffffffffffffe01660200190565b60005b838110610d215750506000910152565b8181015183820152602001610d11565b907fffffffffffffffffffffffffffffffffffffffffffffffffffffffffffffffe0601f602093610d6d81518092818752878088019101610d0e565b0116010190565b602081830312610c435780519067ffffffffffffffff8211610c43570181601f82011215610c43578051610da781610cd4565b92610db56040519485610c93565b81845260208284010111610c4357610dd39160208085019101610d0e565b90565b90919015610de2575090565b815115610df25750805190602001fd5b610e30906040519182917f08c379a0000000000000000000000000000000000000000000000000000000008352602060048401526024830190610d31565b0390fdfea2646970667358221220582793f3983c41d8e98ba54ca4ffee6e8687e411643bc1ca262563747deed4e864736f6c63430008120033",
  "devdoc": {
    "details": "Public functions calling external contracts do not guard against reentrancy because they are expected to be called via delegatecall, which will execute this contract's logic within the context of the originating contract. For example, the HubPool will delegatecall these functions, therefore its only necessary that the HubPool's methods that call this contract's logic guard against reentrancy.",
    "kind": "dev",
    "methods": {
      "constructor": {
        "params": {
          "_l1ArbitrumInbox": "Inbox helper contract to send messages to Arbitrum.",
          "_l1ERC20GatewayRouter": "ERC20 gateway router contract to send tokens to Arbitrum."
        }
      },
      "getL1CallValue(uint32)": {
        "returns": {
          "_0": "amount of ETH that this contract needs to hold in order for relayMessage to succeed."
        }
      },
      "relayMessage(address,bytes)": {
        "params": {
          "message": "Data to send to target.",
          "target": "Contract on Arbitrum that will receive message."
        }
      },
      "relayTokens(address,address,uint256,address)": {
        "params": {
          "amount": "Amount of L1 tokens to deposit and L2 tokens to receive.",
          "l1Token": "L1 token to deposit.",
          "l2Token": "L2 token to receive.",
          "to": "Bridge recipient."
        }
      }
    },
    "version": 1
  },
  "userdoc": {
    "kind": "user",
    "methods": {
      "constructor": {
        "notice": "Constructs new Adapter."
      },
      "getL1CallValue(uint32)": {
        "notice": "Returns required amount of ETH to send a message via the Inbox."
      },
      "relayMessage(address,bytes)": {
        "notice": "Send cross-chain message to target on Arbitrum.This contract must hold at least getL1CallValue() amount of ETH to send a message via the Inbox successfully, or the message will get stuck."
      },
      "relayTokens(address,address,uint256,address)": {
        "notice": "Bridge tokens to Arbitrum.This contract must hold at least getL1CallValue() amount of ETH to send a message via the Inbox successfully, or the message will get stuck."
      }
    },
    "notice": "Contract containing logic to send messages from L1 to Arbitrum.",
    "version": 1
  },
  "storageLayout": {
    "storage": [],
    "types": null
  }
}
